author,comment,date,url,product,stars,price,currency,weight
Владимир,"Один отличный, другой хуже",17 мая 2025  · Карта: xxx34,https://vkusvill.ru/goods/mandariny-nadorkott-69648.html,Мандарины Надоркотт,4,305,руб,/кг
Мария,С кислинкой а написано сладкие,17 мая 2025  · Карта: xxx22,https://vkusvill.ru/goods/mandariny-nadorkott-69648.html,Мандарины Надоркотт,4,305,руб,/кг
Ольга,"Сколько раз покупала этот сорт, никогда не приносили такую мелочь и кислятину ! В объёме всего 4 см ! Яйцо куриное намного крупнее, чем мандарины. Специально только этот сорт беру из-за того, что сладкие, а сегодня только на выброс !",17 мая 2025  · Карта: xxx40,https://vkusvill.ru/goods/mandariny-nadorkott-69648.html,Мандарины Надоркотт,2,305,руб,/кг
Сергей,"Вкусные,сладкие.",17 мая 2025  · Карта: xxx98,https://vkusvill.ru/goods/mandariny-nadorkott-69648.html,Мандарины Надоркотт,5,305,руб,/кг
ЛЮДМИЛА ИВАНОВНА,Суховаты,17 мая 2025  · Карта: xxx55,https://vkusvill.ru/goods/mandariny-nadorkott-69648.html,Мандарины Надоркотт,3,305,руб,/кг
Олеся,Привезли апельсины,17 мая 2025  · Карта: xxx50,https://vkusvill.ru/goods/mandariny-nadorkott-69648.html,Мандарины Надоркотт,1,305,руб,/кг
Роман,"Очень вкусные, хорошо очищаются, сладкие",16 мая 2025  · Карта: xxx73,https://vkusvill.ru/goods/mandariny-nadorkott-69648.html,Мандарины Надоркотт,5,305,руб,/кг
Марина,Вместо мандаринов положили апельсины . Фото не загружается,16 мая 2025  · Карта: xxx19,https://vkusvill.ru/goods/mandariny-nadorkott-69648.html,Мандарины Надоркотт,3,305,руб,/кг
Стася,"не вкусно,наполовину как будто старые и сухие😕",16 мая 2025  · Карта: xxx87,https://vkusvill.ru/goods/mandariny-nadorkott-69648.html,Мандарины Надоркотт,2,305,руб,/кг
ЕЛЕНА,"Хорошие, но очень мелкие мандарины",16 мая 2025  · Карта: xxx50,https://vkusvill.ru/goods/mandariny-nadorkott-69648.html,Мандарины Надоркотт,4,305,руб,/кг
Ирина,Сладкие и крупные.,16 мая 2025  · Карта: xxx78,https://vkusvill.ru/goods/mandariny-nadorkott-69648.html,Мандарины Надоркотт,5,305,руб,/кг
СВЕТЛАНА,Тонкая кожица. Очень сладкие. Без косточек. Топ,16 мая 2025  · Карта: xxx35,https://vkusvill.ru/goods/mandariny-nadorkott-69648.html,Мандарины Надоркотт,5,305,руб,/кг
Ольга,Маленькие но очень сладкие,16 мая 2025  · Карта: xxx94,https://vkusvill.ru/goods/mandariny-nadorkott-69648.html,Мандарины Надоркотт,5,305,руб,/кг
Анастасия,Очень кислые,16 мая 2025  · Карта: xxx76,https://vkusvill.ru/goods/mandariny-nadorkott-69648.html,Мандарины Надоркотт,1,305,руб,/кг
Дарья Александровна,"блестящие, сладкие и без косточек. чистятся отлично",16 мая 2025  · Карта: xxx40,https://vkusvill.ru/goods/mandariny-nadorkott-69648.html,Мандарины Надоркотт,5,305,руб,/кг
Ирина,Безвкусные,16 мая 2025  · Карта: xxx25,https://vkusvill.ru/goods/mandariny-nadorkott-69648.html,Мандарины Надоркотт,3,305,руб,/кг
Юлия,"Конечно очень маленькие, но очень вкусные, главное без косточек",16 мая 2025  · Карта: xxx76,https://vkusvill.ru/goods/mandariny-nadorkott-69648.html,Мандарины Надоркотт,5,305,руб,/кг
Юлия,"Просто супер, спасибо 🌹",16 мая 2025  · Карта: xxx84,https://vkusvill.ru/goods/mandariny-nadorkott-69648.html,Мандарины Надоркотт,5,305,руб,/кг
ВЯЧЕСЛАВ АЛЕКСАНДРОВИЧ,"Мандарины испорченные, видна плесень. Не товарный внешний вид.",16 мая 2025  · Карта: xxx05,https://vkusvill.ru/goods/mandariny-nadorkott-69648.html,Мандарины Надоркотт,1,305,руб,/кг
ЕВГЕНИЯ,"Странный привкус и запах, совсем не мандаринов 🤔",16 мая 2025  · Карта: xxx64,https://vkusvill.ru/goods/mandariny-nadorkott-69648.html,Мандарины Надоркотт,3,305,руб,/кг
Юлия & Евгений,Раньше были крупные и сладкие. Теперь же эти мандарины размером с крупную виноградину и на вкус кислят. По крайней мере такое привезли мне. Это точно надоркот?,16 мая 2025  · Карта: xxx44,https://vkusvill.ru/goods/mandariny-nadorkott-69648.html,Мандарины Надоркотт,4,305,руб,/кг
Александр,Мне специально мелочь сыпали ?,15 мая 2025  · Карта: xxx72,https://vkusvill.ru/goods/mandariny-nadorkott-69648.html,Мандарины Надоркотт,2,305,руб,/кг
ОЛЬГА,"Мандарины роскошные, крупные, сладкие, легко чистятся.",15 мая 2025  · Карта: xxx00,https://vkusvill.ru/goods/mandariny-nadorkott-69648.html,Мандарины Надоркотт,5,305,руб,/кг
Ольга,"Заказала мандарины Надоркотт, привезли не те мандарины, какую- мелочь целый пакет. Или ваши васовщики думаюя, что челоаек заказывает и можно его обманывать, всякую ***** накладывать, сто первое попадеться под руки. Я, что незнаю, как выглядят мандарины этого сорта. Вчера, так же заказывала привезли крупные и хорошие.",15 мая 2025  · Карта: xxx45,https://vkusvill.ru/goods/mandariny-nadorkott-69648.html,Мандарины Надоркотт,1,305,руб,/кг
Людмила,Привезли абсолютно другой сорт.даже одна этикетка осталась,15 мая 2025  · Карта: xxx34,https://vkusvill.ru/goods/mandariny-nadorkott-69648.html,Мандарины Надоркотт,2,305,руб,/кг
Ирина,Из 590гр один внутри гнилой.,15 мая 2025  · Карта: xxx77,https://vkusvill.ru/goods/mandariny-nadorkott-69648.html,Мандарины Надоркотт,4,305,руб,/кг
Нина Разуваева,"Сочные,не кислые,вкус нормальный",15 мая 2025  · Карта: xxx91,https://vkusvill.ru/goods/mandariny-nadorkott-69648.html,Мандарины Надоркотт,4,305,руб,/кг
Елена,Плохо чистятся. По вкусу нормально,15 мая 2025  · Карта: xxx61,https://vkusvill.ru/goods/mandariny-nadorkott-69648.html,Мандарины Надоркотт,4,305,руб,/кг
ТАМАРА АЛЕКСАНДРОВНА,"Отличные, сладкие, сочные мандарины!!!🙏",15 мая 2025  · Карта: xxx08,https://vkusvill.ru/goods/mandariny-nadorkott-69648.html,Мандарины Надоркотт,5,305,руб,/кг
Аланочка,"Шикарные! Очень сладкие, вкусные. Могу килограмм за день съесть)",15 мая 2025  · Карта: xxx26,https://vkusvill.ru/goods/mandariny-nadorkott-69648.html,Мандарины Надоркотт,5,305,руб,/кг
Маргарита,"Сухие внутри, хотя вроде тяжелые и плотные снаружи",15 мая 2025  · Карта: xxx60,https://vkusvill.ru/goods/mandariny-nadorkott-69648.html,Мандарины Надоркотт,3,305,руб,/кг
Татьяна,"Сочные, но НЕ СЛАДКИЕ, я бы даже сказала, что никакие по вкусу",15 мая 2025  · Карта: xxx48,https://vkusvill.ru/goods/mandariny-nadorkott-69648.html,Мандарины Надоркотт,3,305,руб,/кг
Анатолий,Не повезло. :(,14 мая 2025  · Карта: xxx52,https://vkusvill.ru/goods/mandariny-nadorkott-69648.html,Мандарины Надоркотт,2,305,руб,/кг
Татьяна,"Очень вкусные, сочные!",14 мая 2025  · Карта: xxx47,https://vkusvill.ru/goods/mandariny-nadorkott-69648.html,Мандарины Надоркотт,5,305,руб,/кг
Елена Владимиров,"По ЗЦ , но вполне вкусные, кисло- сладкие",14 мая 2025  · Карта: xxx47,https://vkusvill.ru/goods/mandariny-nadorkott-69648.html,Мандарины Надоркотт,5,305,руб,/кг
Галина,Очень сухие и не вкусные выброшенные деньги,14 мая 2025  · Карта: xxx40,https://vkusvill.ru/goods/mandariny-nadorkott-69648.html,Мандарины Надоркотт,1,305,руб,/кг
Светлана,"Очень мелкие и кислые. Специально выбирала их в качестве любимого продукта, так как в других заказах были крупные и очень сладкие. Странно, что мандарины одного сорта могут быть такие разные.",14 мая 2025  · Карта: xxx04,https://vkusvill.ru/goods/mandariny-nadorkott-69648.html,Мандарины Надоркотт,3,305,руб,/кг
ПОЛИНА АЛЕКСАНДРОВНА,"Уже не в сезоне, ватные были(",14 мая 2025  · Карта: xxx84,https://vkusvill.ru/goods/mandariny-nadorkott-69648.html,Мандарины Надоркотт,3,305,руб,/кг
Алсу,"Брала по недельной скидке и осталась недовольна. Толстая кожура, мякоть рыхлая, вялая, какие-то даже забродившие по вкусу, от сладости осталось одно название. До этого брали по ЗЦ, таких проблем не было. Уфа",14 мая 2025  · Карта: xxx15,https://vkusvill.ru/goods/mandariny-nadorkott-69648.html,Мандарины Надоркотт,4,305,руб,/кг
Вадим Васильевич,"ВАДИМ.
Очень сладкие и сочные! Косточек очень мало. (Рекомендовать не буду, а то всё разберут и мне не достанется!) 😂 Здесь писали, что мелкие и кислые, но в наших магазинах таких нет! Только крупные. Район Крылатское.",14 мая 2025  · Карта: xxx45,https://vkusvill.ru/goods/mandariny-nadorkott-69648.html,Мандарины Надоркотт,5,305,руб,/кг
ТАТЬЯНА,"Мандарины вкусные и сочные, только плохо чистятся, может быть от того, что долго лежали и я их покупала с уценкой",14 мая 2025  · Карта: xxx44,https://vkusvill.ru/goods/mandariny-nadorkott-69648.html,Мандарины Надоркотт,4,305,руб,/кг
Анастасия,"Мандарины плохого качества.
Они старые.",14 мая 2025  · Карта: xxx69,https://vkusvill.ru/goods/mandariny-nadorkott-69648.html,Мандарины Надоркотт,1,305,руб,/кг
СВЕТЛАНА,Как горох ((( и старые пожухлые,14 мая 2025  · Карта: xxx96,https://vkusvill.ru/goods/mandariny-nadorkott-69648.html,Мандарины Надоркотт,1,305,руб,/кг
НАДЕЖДА,"Толстенная, тяжелая шкура. Покупала по зц(наверное по этому мякоть такая вялая)",14 мая 2025  · Карта: xxx75,https://vkusvill.ru/goods/mandariny-nadorkott-69648.html,Мандарины Надоркотт,3,305,руб,/кг
ЛЮДМИЛА,"Совсем без косточек, чистятся хорошо, сочные.",14 мая 2025  · Карта: xxx34,https://vkusvill.ru/goods/mandariny-nadorkott-69648.html,Мандарины Надоркотт,5,305,руб,/кг
Алла,"Кисловаты, мелкие",14 мая 2025  · Карта: xxx16,https://vkusvill.ru/goods/mandariny-nadorkott-69648.html,Мандарины Надоркотт,4,305,руб,/кг
Людмила,"В заказе от 10 мая мандарины намного вкуснее, чем от 3 мая. Вкус более насыщенный. Чистятся легко, без косточек",14 мая 2025  · Карта: xxx54,https://vkusvill.ru/goods/mandariny-nadorkott-69648.html,Мандарины Надоркотт,5,305,руб,/кг
Светлана,"Вкусные мандарины, сочные, сладкие, пока лучшие из тех, что брали!",14 мая 2025  · Карта: xxx41,https://vkusvill.ru/goods/mandariny-nadorkott-69648.html,Мандарины Надоркотт,5,305,руб,/кг
Анна,"С кислинкой, ждала сладкие !",13 мая 2025  · Карта: xxx35,https://vkusvill.ru/goods/mandariny-nadorkott-69648.html,Мандарины Надоркотт,1,305,руб,/кг
Елена,"Последний раз привезли размером чуть больше гороха, хотя просила крупные и если не будет чтобы удалили. Даже есть не стала. Один раз такие привозили, была жуткая кислятина. Кислое не переношу.",13 мая 2025  · Карта: xxx43,https://vkusvill.ru/goods/mandariny-nadorkott-69648.html,Мандарины Надоркотт,3,305,руб,/кг
Наталья,"Кожура толстая, мандарины сладкие, косточек, практически нет.",13 мая 2025  · Карта: xxx80,https://vkusvill.ru/goods/mandariny-nadorkott-69648.html,Мандарины Надоркотт,4,305,руб,/кг
Мария,"Нормальные. Сладкие, без костей. Мелкие правда. Зато кожица тонкая.",13 мая 2025  · Карта: xxx54,https://vkusvill.ru/goods/mandariny-nadorkott-69648.html,Мандарины Надоркотт,5,305,руб,/кг
Наталья Геннадьевна,Очень вкусные,13 мая 2025  · Карта: xxx62,https://vkusvill.ru/goods/mandariny-nadorkott-69648.html,Мандарины Надоркотт,5,305,руб,/кг
Руслан,Без вкуса,13 мая 2025  · Карта: xxx25,https://vkusvill.ru/goods/mandariny-nadorkott-69648.html,Мандарины Надоркотт,1,305,руб,/кг
Светлана,Очень мелкие и кислые.,13 мая 2025  · Карта: xxx46,https://vkusvill.ru/goods/mandariny-nadorkott-69648.html,Мандарины Надоркотт,3,305,руб,/кг
Анастасия,"Сладкие, без косточек мандарины.",13 мая 2025  · Карта: xxx51,https://vkusvill.ru/goods/mandariny-nadorkott-69648.html,Мандарины Надоркотт,5,305,руб,/кг
СВЕТЛАНА ЮРЬЕВНА,Очень мелкие. Это Надоркотт или мини мандарины?,13 мая 2025  · Карта: xxx38,https://vkusvill.ru/goods/mandariny-nadorkott-69648.html,Мандарины Надоркотт,3,305,руб,/кг
ЛИДИЯ ПЕТРОВНА,Ирочка,13 мая 2025  · Карта: xxx59,https://vkusvill.ru/goods/mandariny-nadorkott-69648.html,Мандарины Надоркотт,5,305,руб,/кг
Елена,"Большие, сочные, но абсолютно безвкусные. Как вода, вкуса нет абсолютно.",13 мая 2025  · Карта: xxx50,https://vkusvill.ru/goods/mandariny-nadorkott-69648.html,Мандарины Надоркотт,3,305,руб,/кг
Евгения,"Высохшие внутри, не сочные",13 мая 2025  · Карта: xxx08,https://vkusvill.ru/goods/mandariny-nadorkott-69648.html,Мандарины Надоркотт,3,305,руб,/кг
Ирина,"Привезли мандарины не то что не первой свежести, а столетней давности.. Сколько они лежали на складе, вот вопрос?!!! Внутри уменьшились в раз. Высохли так, что в кожуре болтаются отдельно. Ну что за качество? Ну почему ВВ такое продает?!!! Не советую к покупке.",13 мая 2025  · Карта: xxx90,https://vkusvill.ru/goods/mandariny-nadorkott-69648.html,Мандарины Надоркотт,1,305,руб,/кг
Екатерина,привезли мелкие и кислые вместо крупных сладких!!!,13 мая 2025  · Карта: xxx72,https://vkusvill.ru/goods/mandariny-nadorkott-69648.html,Мандарины Надоркотт,1,305,руб,/кг
Татьана,"Сладкие , но сухие(",13 мая 2025  · Карта: xxx32,https://vkusvill.ru/goods/mandariny-nadorkott-69648.html,Мандарины Надоркотт,3,305,руб,/кг
ЮЛИЯ,"Вкус непонятный, как будто испорчены.",13 мая 2025  · Карта: xxx53,https://vkusvill.ru/goods/mandariny-nadorkott-69648.html,Мандарины Надоркотт,3,305,руб,/кг
Татьяна,Уже подсохшие и скоро умрут..,13 мая 2025  · Карта: xxx27,https://vkusvill.ru/goods/mandariny-nadorkott-69648.html,Мандарины Надоркотт,1,305,руб,/кг
Екатерина,Мандарины уже на исходе своего товарного вида уже подсыхают.,13 мая 2025  · Карта: xxx07,https://vkusvill.ru/goods/mandariny-nadorkott-69648.html,Мандарины Надоркотт,3,305,руб,/кг
Наталья,"Мандарины привезли крупные, сочные, вкусные, без косточек. Легко чистятся.",13 мая 2025  · Карта: xxx19,https://vkusvill.ru/goods/mandariny-nadorkott-69648.html,Мандарины Надоркотт,5,305,руб,/кг
Юлия,Очень вкусные мандарины! Чистятся тоже хорошо.,12 мая 2025  · Карта: xxx43,https://vkusvill.ru/goods/mandariny-nadorkott-69648.html,Мандарины Надоркотт,5,305,руб,/кг
Людмила,Очень вкусные,12 мая 2025  · Карта: xxx86,https://vkusvill.ru/goods/mandariny-nadorkott-69648.html,Мандарины Надоркотт,5,305,руб,/кг
Константин,"Отличные крупные, сладкие мандарины.",12 мая 2025  · Карта: xxx80,https://vkusvill.ru/goods/mandariny-nadorkott-69648.html,Мандарины Надоркотт,5,305,руб,/кг
Юрий,Именно в этот раз были сухие,12 мая 2025  · Карта: xxx79,https://vkusvill.ru/goods/mandariny-nadorkott-69648.html,Мандарины Надоркотт,3,305,руб,/кг
Елена,"Это уже сухофрукты, понятно, что овощи и фрукты по зеленому ценнику это риск, но обычно мне везло больше",12 мая 2025  · Карта: xxx39,https://vkusvill.ru/goods/mandariny-nadorkott-69648.html,Мандарины Надоркотт,2,305,руб,/кг
Мария,"Прекрасные мандарины
Косточек или вообще нет или мало
Сладкие",12 мая 2025  · Карта: xxx91,https://vkusvill.ru/goods/mandariny-nadorkott-69648.html,Мандарины Надоркотт,5,305,руб,/кг
Покупатель,"Вот и вкусвилл начал обманывать. Пару дней назад брали эти мандарины - очень понравились,люблю этот сорт беру каждый год,решили взять ещё . И вот привезли пакет мелких как семечки ,дико кислых с кожурой тонкой как пленка. У меня остался один с прошлого заказа для сравнения,стандартного размера этого сорта , надеюсь на фото вы видите разницу. Даже на фото сайта изображён в разрезе с более толстой кожурой ,как и должна быть. И этот сорт - не кислый. Что вы мне привезли? Что не продается видимо.",12 мая 2025  · Карта: xxx03,https://vkusvill.ru/goods/mandariny-nadorkott-69648.html,Мандарины Надоркотт,1,305,руб,/кг
Татьяна,"Вкусные сочные , сладкие с кислинкой",12 мая 2025  · Карта: xxx32,https://vkusvill.ru/goods/mandariny-nadorkott-69648.html,Мандарины Надоркотт,5,305,руб,/кг
Марина Королевич,Сладкие. Иногда суховатые. Не смертельно.,11 мая 2025  · Карта: xxx31,https://vkusvill.ru/goods/mandariny-nadorkott-69648.html,Мандарины Надоркотт,5,305,руб,/кг
Вероника,Кислые,11 мая 2025  · Карта: xxx84,https://vkusvill.ru/goods/mandariny-nadorkott-69648.html,Мандарины Надоркотт,3,305,руб,/кг
Инна,"Любимые мандарины: сочные, сладкие",11 мая 2025  · Карта: xxx24,https://vkusvill.ru/goods/mandariny-nadorkott-69648.html,Мандарины Надоркотт,5,305,руб,/кг
Виктория,На вид не очень. Но сладкие. Для мая вообще огонь!,11 мая 2025  · Карта: xxx63,https://vkusvill.ru/goods/mandariny-nadorkott-69648.html,Мандарины Надоркотт,5,305,руб,/кг
Наталья,"Брала по ЗЦ, мандарины уже подвядшие и совсем мелкие, ощущение, что это совсем другой сорт",11 мая 2025  · Карта: xxx74,https://vkusvill.ru/goods/mandariny-nadorkott-69648.html,Мандарины Надоркотт,3,305,руб,/кг
Марина,"Мелкие,но сладкие",10 мая 2025  · Карта: xxx11,https://vkusvill.ru/goods/mandariny-nadorkott-69648.html,Мандарины Надоркотт,5,305,руб,/кг
Марина,"Вкусные, сочные, сладкие",10 мая 2025  · Карта: xxx63,https://vkusvill.ru/goods/mandariny-nadorkott-69648.html,Мандарины Надоркотт,5,305,руб,/кг
Мария,Размер мандаринов 3 см.,10 мая 2025  · Карта: xxx41,https://vkusvill.ru/goods/mandariny-nadorkott-69648.html,Мандарины Надоркотт,1,305,руб,/кг
Елена,"В течение недели заказывала как любимый продукт. Приносили маленькие и сладкие мандарины. Радовали. А сегодня вдруг данных сорт увеличился в размере раза в 3 , как апельсин. Боюсь пробовать. Обычно такие кислые и с косточками.",10 мая 2025  · Карта: xxx98,https://vkusvill.ru/goods/mandariny-nadorkott-69648.html,Мандарины Надоркотт,1,305,руб,/кг
Наталия,"Сухие очень, мякоть вообще не сочная",10 мая 2025  · Карта: xxx47,https://vkusvill.ru/goods/mandariny-nadorkott-69648.html,Мандарины Надоркотт,3,305,руб,/кг
Вероника,"Много плохих и сухих. Видимо, сезон этих мандаринок уже заканчивается. Полное разочарование",10 мая 2025  · Карта: xxx61,https://vkusvill.ru/goods/mandariny-nadorkott-69648.html,Мандарины Надоркотт,1,305,руб,/кг
НАТАЛЬЯ,"Мелкие, кисло сладкие, очень вкусные, только не поняла, чем отличаются от Муркот.",10 мая 2025  · Карта: xxx97,https://vkusvill.ru/goods/mandariny-nadorkott-69648.html,Мандарины Надоркотт,5,305,руб,/кг
АНАСТАСИЯ,"Вкус забродивший. Купила для ребёнка, не сразу сама попробовала.",10 мая 2025  · Карта: xxx39,https://vkusvill.ru/goods/mandariny-nadorkott-69648.html,Мандарины Надоркотт,1,305,руб,/кг
Айдан,"мелкий, плохо чистится, с кислинкой и косточками",09 мая 2025  · Карта: xxx51,https://vkusvill.ru/goods/mandariny-nadorkott-69648.html,Мандарины Надоркотт,3,305,руб,/кг
