author,comment,date,url,product,stars,price,currency,weight
ПЁТР,Сухие и безвкусные,09 мая 2025  · Карта: xxx18,https://vkusvill.ru/goods/mandariny-nadorkott-69648.html,Мандарины Надоркотт,2,305,руб,/кг
Мария,"Попробовать не довелось, купила по ЗЦ - все 600г испорченные и с плесенью, пришлось выкинуть в помойку. Наверное с покупками в ВВ придется заканчивать, сеть очень сильно скатилась по качеству((",09 мая 2025  · Карта: xxx24,https://vkusvill.ru/goods/mandariny-nadorkott-69648.html,Мандарины Надоркотт,1,305,руб,/кг
Надежда,"Мандарины снаружи выглядели хорошо, внутри оказались засохшие и, соответственно, не сочные.",09 мая 2025  · Карта: xxx41,https://vkusvill.ru/goods/mandariny-nadorkott-69648.html,Мандарины Надоркотт,3,305,руб,/кг
Андрей,"В целом неплохо. Только в разных партиях разные вкусы, не всегда приятные.",09 мая 2025  · Карта: xxx93,https://vkusvill.ru/goods/mandariny-nadorkott-69648.html,Мандарины Надоркотт,4,305,руб,/кг
Галина,Огромные и гнилые.,09 мая 2025  · Карта: xxx43,https://vkusvill.ru/goods/mandariny-nadorkott-69648.html,Мандарины Надоркотт,1,305,руб,/кг
Екатерина,"Старые мандарины уже, высохшие",09 мая 2025  · Карта: xxx65,https://vkusvill.ru/goods/mandariny-nadorkott-69648.html,Мандарины Надоркотт,3,305,руб,/кг
Ольга,"Раньше были крупные, сейчас - размером с редиску",09 мая 2025  · Карта: xxx51,https://vkusvill.ru/goods/mandariny-nadorkott-69648.html,Мандарины Надоркотт,2,305,руб,/кг
ЛИЛИЯ,Минус звезда за отсутствие в карточке товара страны производителя,09 мая 2025  · Карта: xxx87,https://vkusvill.ru/goods/mandariny-nadorkott-69648.html,Мандарины Надоркотт,4,305,руб,/кг
ВИКТОРИЯ,Маленькие и кислые мандарины.,08 мая 2025  · Карта: xxx35,https://vkusvill.ru/goods/mandariny-nadorkott-69648.html,Мандарины Надоркотт,4,305,руб,/кг
Виталий,"В этот раз оказался не очень, слегка подпорченный, и даже кислый местами.",08 мая 2025  · Карта: xxx35,https://vkusvill.ru/goods/mandariny-nadorkott-69648.html,Мандарины Надоркотт,2,305,руб,/кг
Ирина,"Некоторые не очень сочные. Ощущение, что долго лежали",08 мая 2025  · Карта: xxx46,https://vkusvill.ru/goods/mandariny-nadorkott-69648.html,Мандарины Надоркотт,3,305,руб,/кг
София,"Не понравились мандарины, не вкусные",08 мая 2025  · Карта: xxx59,https://vkusvill.ru/goods/mandariny-nadorkott-69648.html,Мандарины Надоркотт,3,305,руб,/кг
ИРИНА,"Напихали гниль. Половина мандаринов высозло, половина с почерневшей шкуркой.",08 мая 2025  · Карта: xxx63,https://vkusvill.ru/goods/mandariny-nadorkott-69648.html,Мандарины Надоркотт,1,305,руб,/кг
ОЛЬГА,"Сладкие, вкус ные с тончайшей кожицей.",08 мая 2025  · Карта: xxx97,https://vkusvill.ru/goods/mandariny-nadorkott-69648.html,Мандарины Надоркотт,5,305,руб,/кг
Дарья,"Божественные мандарины, очень вкусные, легко чистятся, кожура тонкая , но легко отходит, мало косточек и красивые, надо было брать больше)",08 мая 2025  · Карта: xxx14,https://vkusvill.ru/goods/mandariny-nadorkott-69648.html,Мандарины Надоркотт,5,305,руб,/кг
Елена,"сочные, сладкие",07 мая 2025  · Карта: xxx02,https://vkusvill.ru/goods/mandariny-nadorkott-69648.html,Мандарины Надоркотт,5,305,руб,/кг
Татьяна,"Очень вкусные!Жаль,что привозить стали мелкие из Марокко.",07 мая 2025  · Карта: xxx17,https://vkusvill.ru/goods/mandariny-nadorkott-69648.html,Мандарины Надоркотт,5,305,руб,/кг
ЛЮДМИЛА,Вкусный сладкие Косточек нет,07 мая 2025  · Карта: xxx77,https://vkusvill.ru/goods/mandariny-nadorkott-69648.html,Мандарины Надоркотт,5,305,руб,/кг
Ирина,"Шикарные! сладкие, сочные, ароматные",07 мая 2025  · Карта: xxx45,https://vkusvill.ru/goods/mandariny-nadorkott-69648.html,Мандарины Надоркотт,5,305,руб,/кг
ОЛЬГА,Как бумага местами сухие,07 мая 2025  · Карта: xxx66,https://vkusvill.ru/goods/mandariny-nadorkott-69648.html,Мандарины Надоркотт,3,305,руб,/кг
НИНА,"Сладкие, сочные, вкусные!",07 мая 2025  · Карта: xxx19,https://vkusvill.ru/goods/mandariny-nadorkott-69648.html,Мандарины Надоркотт,5,305,руб,/кг
НАТАЛЬЯ,Порченные,07 мая 2025  · Карта: xxx02,https://vkusvill.ru/goods/mandariny-nadorkott-69648.html,Мандарины Надоркотт,2,305,руб,/кг
Елена,"Мелкие , как горох",07 мая 2025  · Карта: xxx55,https://vkusvill.ru/goods/mandariny-nadorkott-69648.html,Мандарины Надоркотт,3,305,руб,/кг
ТАТЬЯНА,"Постоянно покупаю мандарины этого сорта и впервые вижу их мелкими, кисло-сладкими, с тонкой кожицей. Есть сомнения, что собрали то, что мне было нужно.",07 мая 2025  · Карта: xxx75,https://vkusvill.ru/goods/mandariny-nadorkott-69648.html,Мандарины Надоркотт,2,305,руб,/кг
Ольга,"Чуть сладкие, но немного суховаты",07 мая 2025  · Карта: xxx52,https://vkusvill.ru/goods/mandariny-nadorkott-69648.html,Мандарины Надоркотт,4,305,руб,/кг
Наталья,"Очень жаль, но качество товара изменилось. Вместо крупных с толстой кожурой сладких мандарин в заказе мелкие кислые мандарины. Что это? Пересортица? На фотографии видны варианты ""до"" и ""после"" - крупные и мелкие с блестящей кожицей. Ну, и при покупке 1 кг обязательно появляется один мандарин с плесенью.",07 мая 2025  · Карта: xxx40,https://vkusvill.ru/goods/mandariny-nadorkott-69648.html,Мандарины Надоркотт,1,305,руб,/кг
Ярослав,"Мандарины с плесенью.

Возврат.",07 мая 2025  · Карта: xxx39,https://vkusvill.ru/goods/mandariny-nadorkott-69648.html,Мандарины Надоркотт,1,305,руб,/кг
Наталья,"Замечательные мандарины! Никогда бы не подумала, что буду килограммами есть мандарины весной. В начале апреля привлекли своим внешним видом в магазине, но не было возможности купить с собой, заказали доставкой на дом и с тех пор съели килограмм 7. Я даже ничего не писала сборщику (как привыкла в отношении других фруктов и овощей), всегда привозили отличные мандарины. Сладкие, легко чистятся, достаточно сочные, единицы попадались с косточками, но таких правда минимум, за раз легко было увлечься и съесть штук 5-7 сразу.",07 мая 2025  · Карта: xxx02,https://vkusvill.ru/goods/mandariny-nadorkott-69648.html,Мандарины Надоркотт,5,305,руб,/кг
ТАТЬЯНА,"Совершенно сухие внутри, не ожидала такого от продавца",06 мая 2025  · Карта: xxx30,https://vkusvill.ru/goods/mandariny-nadorkott-69648.html,Мандарины Надоркотт,1,305,руб,/кг
ВЕРОНИКА,Мандарины попались вкусные и довольно крупные.,06 мая 2025  · Карта: xxx08,https://vkusvill.ru/goods/mandariny-nadorkott-69648.html,Мандарины Надоркотт,5,305,руб,/кг
Алексей Чистопашин,Сладкие,06 мая 2025  · Карта: xxx87,https://vkusvill.ru/goods/mandariny-nadorkott-69648.html,Мандарины Надоркотт,5,305,руб,/кг
Влад,"Привезли какую то мелкую фигню,все 4 см,кисловатые с косточками,незнаю кто напутал,поставщик или сборщик.",06 мая 2025  · Карта: xxx44,https://vkusvill.ru/goods/mandariny-nadorkott-69648.html,Мандарины Надоркотт,3,305,руб,/кг
ТАТЬЯНА,"Сладкий, сочный, костей мало, но многие были зеленые. Не спелые были.",06 мая 2025  · Карта: xxx42,https://vkusvill.ru/goods/mandariny-nadorkott-69648.html,Мандарины Надоркотт,4,305,руб,/кг
Яночка,Добрый день. Мне привезли не те мандарины и качество их расстраивает,06 мая 2025  · Карта: xxx80,https://vkusvill.ru/goods/mandariny-nadorkott-69648.html,Мандарины Надоркотт,1,305,руб,/кг
Алёна,Очень вкусные,06 мая 2025  · Карта: xxx61,https://vkusvill.ru/goods/mandariny-nadorkott-69648.html,Мандарины Надоркотт,5,305,руб,/кг
ТАТЬЯНА,"Хоть и мелковаты, но вполне мандаринов вкус: сладость с кислинкой",06 мая 2025  · Карта: xxx97,https://vkusvill.ru/goods/mandariny-nadorkott-69648.html,Мандарины Надоркотт,5,305,руб,/кг
Сагар,Испорченный внутри сухие,05 мая 2025  · Карта: xxx46,https://vkusvill.ru/goods/mandariny-nadorkott-69648.html,Мандарины Надоркотт,2,305,руб,/кг
ЕЛЕНА,"Не сладкие! Не похожи на этот сорт. Но все свежие и сочные. До этого брали, были сладкие.",05 мая 2025  · Карта: xxx21,https://vkusvill.ru/goods/mandariny-nadorkott-69648.html,Мандарины Надоркотт,3,305,руб,/кг
Ирина,"Вкусные, но внутри уже как курага.",05 мая 2025  · Карта: xxx94,https://vkusvill.ru/goods/mandariny-nadorkott-69648.html,Мандарины Надоркотт,4,305,руб,/кг
ЕКАТЕРИНА,"Мандарины уже высохли , к сожалению",05 мая 2025  · Карта: xxx92,https://vkusvill.ru/goods/mandariny-nadorkott-69648.html,Мандарины Надоркотт,2,305,руб,/кг
Константин,Цукини 2ун2,05 мая 2025  · Карта: xxx32,https://vkusvill.ru/goods/mandariny-nadorkott-69648.html,Мандарины Надоркотт,1,305,руб,/кг
ИРИНА,"Мелкие, но очень сладкие",05 мая 2025  · Карта: xxx98,https://vkusvill.ru/goods/mandariny-nadorkott-69648.html,Мандарины Надоркотт,5,305,руб,/кг
ТАТЬЯНА,"Сладкие,сочные мандарины",05 мая 2025  · Карта: xxx11,https://vkusvill.ru/goods/mandariny-nadorkott-69648.html,Мандарины Надоркотт,5,305,руб,/кг
ЕЛЕНА ВАДИМОВНА,"Правда сладкие! Но! Мелкие!!!(4-5 см диаметром) возможно в этой партии! Кому это ""не комильфо"" - учитывайте. И было бы неплохо, если в описании продукта это было. Я вот не люблю мелочь чистить, и не взяла бы их, если б на прилавке выбирала - ставлю ""5""! потому что они правда сладкие! Надеюсь, съедим)) 🙂",05 мая 2025  · Карта: xxx79,https://vkusvill.ru/goods/mandariny-nadorkott-69648.html,Мандарины Надоркотт,5,305,руб,/кг
ЛЮДМИЛА,"Поставщики, вероятно, перепутали сорт ""надоркотт"" с каким-то иным. Мандаринки очень маленькие, очень кислые. Их описание совпадает только в одном — они легко чистятся. Почти во всех отзывах покупатели высказывают такое же недовольство. Недавно заказывала этот сорт мандаринок. Это и был ""надоркотт"" с настоящим запахом, значительно больше по размеру, сладкими плодами.",05 мая 2025  · Карта: xxx70,https://vkusvill.ru/goods/mandariny-nadorkott-69648.html,Мандарины Надоркотт,1,305,руб,/кг
Татьяна,"Хорошие мандарины. Маленькие, но с тонкой шкуркой. Сладкие, но не приторные. Сочные.",05 мая 2025  · Карта: xxx02,https://vkusvill.ru/goods/mandariny-nadorkott-69648.html,Мандарины Надоркотт,5,305,руб,/кг
НИНА СЕРГЕЕВНА,"Кислые, покупала по зеленному ценнику, чтобы попообовать. 6 из 9 маленьких мандаринок были гнилые. Пришлось выбросить.",05 мая 2025  · Карта: xxx59,https://vkusvill.ru/goods/mandariny-nadorkott-69648.html,Мандарины Надоркотт,2,305,руб,/кг
Наталья,Мандарины все высохшие внутри. Не понимаю как сделать возврат.,05 мая 2025  · Карта: xxx93,https://vkusvill.ru/goods/mandariny-nadorkott-69648.html,Мандарины Надоркотт,1,305,руб,/кг
Екатерина,Привезли гнилые. Возврат,04 мая 2025  · Карта: xxx85,https://vkusvill.ru/goods/mandariny-nadorkott-69648.html,Мандарины Надоркотт,1,305,руб,/кг
Марина,Вкусные,04 мая 2025  · Карта: xxx42,https://vkusvill.ru/goods/mandariny-nadorkott-69648.html,Мандарины Надоркотт,5,305,руб,/кг
Кристина,"Гипер сладкие мандарины, некоторые прям на грани , чтобы испортиться",04 мая 2025  · Карта: xxx44,https://vkusvill.ru/goods/mandariny-nadorkott-69648.html,Мандарины Надоркотт,4,305,руб,/кг
ЕЛЕНА,По вкусу не моё,04 мая 2025  · Карта: xxx57,https://vkusvill.ru/goods/mandariny-nadorkott-69648.html,Мандарины Надоркотт,3,305,руб,/кг
Дмитрий,"Мандарины видимо лежат еще с декабря 2024. Они уже скукоженные, сухие и замученные. Честно стыдно такое продавать, вкус вилл, где Ваш контроль качества продуктов??? Такой товар пора списать, а не продавать. Рассчитываешь покушать, а по итогу всё выбрасывать приходится.",04 мая 2025  · Карта: xxx86,https://vkusvill.ru/goods/mandariny-nadorkott-69648.html,Мандарины Надоркотт,1,305,руб,/кг
ИРИНА,"Привезли очень мелкие и кислые, хотя до этого заказывали накануне были крупные и сладкие.",04 мая 2025  · Карта: xxx81,https://vkusvill.ru/goods/mandariny-nadorkott-69648.html,Мандарины Надоркотт,1,305,руб,/кг
Татьяна Валентиновна,Мандарины Надоркотт сочные и сладкие. Звезду сняла за наличие в заказе подпорченных.,04 мая 2025  · Карта: xxx28,https://vkusvill.ru/goods/mandariny-nadorkott-69648.html,Мандарины Надоркотт,4,305,руб,/кг
ЛЮБОВЬ,"Мандарины только внешне привлекательные, а под кожурой они сухие, лежалые, несъедобные",04 мая 2025  · Карта: xxx92,https://vkusvill.ru/goods/mandariny-nadorkott-69648.html,Мандарины Надоркотт,1,305,руб,/кг
ЮЛИЯ,"Вкусные, сочные!",04 мая 2025  · Карта: xxx62,https://vkusvill.ru/goods/mandariny-nadorkott-69648.html,Мандарины Надоркотт,5,305,руб,/кг
Виктория,"По ЗЦ прислали с плесенью и жухлые. Могли бы и сразу выкинуть, без моего участия)",04 мая 2025  · Карта: xxx96,https://vkusvill.ru/goods/mandariny-nadorkott-69648.html,Мандарины Надоркотт,2,305,руб,/кг
МАРИНА,"Мандарины ооочень вкусные, по размеру аккуратные - маленькие, легко чистятся, оболочка легко пережевывается. Без косточек. Не знаю, почему есть плохие отзывы, видимо, каждому своё. Но эти мандарины абалденные. Жалко, что мало взяла, возьму ещё.",04 мая 2025  · Карта: xxx81,https://vkusvill.ru/goods/mandariny-nadorkott-69648.html,Мандарины Надоркотт,5,305,руб,/кг
Ирина,"Сладкие, с косточками.",03 мая 2025  · Карта: xxx29,https://vkusvill.ru/goods/mandariny-nadorkott-69648.html,Мандарины Надоркотт,5,305,руб,/кг
Мария,"Мандарины шикарные. Первый раз в мае ем мандарины такие, как на новый год. Вкусные, сладкие, без косточек, легко чистятся, мелковатые, но это даже лучше,напоминают абхазские!!! Купила на пробу по ЗЦ. Благодарю сборщиков за отлично выбранный товар-мандаринка к мандаринке, как будто сама выбирала.",03 мая 2025  · Карта: xxx80,https://vkusvill.ru/goods/mandariny-nadorkott-69648.html,Мандарины Надоркотт,5,305,руб,/кг
Людмила,"Хорошие мандарины, но не отличные.",03 мая 2025  · Карта: xxx54,https://vkusvill.ru/goods/mandariny-nadorkott-69648.html,Мандарины Надоркотт,4,305,руб,/кг
Юлия,Сладкие и вкусные) хоть и с косточками),03 мая 2025  · Карта: xxx16,https://vkusvill.ru/goods/mandariny-nadorkott-69648.html,Мандарины Надоркотт,5,305,руб,/кг
Дарья,Мандарины мелкие и достаточно кислые,03 мая 2025  · Карта: xxx66,https://vkusvill.ru/goods/mandariny-nadorkott-69648.html,Мандарины Надоркотт,2,305,руб,/кг
Альбина,"В такое время года , но мандаринки и сочные , не пересладкие, хорошо чистятся и довольно крупненькие!!!",03 мая 2025  · Карта: xxx71,https://vkusvill.ru/goods/mandariny-nadorkott-69648.html,Мандарины Надоркотт,5,305,руб,/кг
Клеотрас,"Надо выбирать самостоятельно, чтобы попались отличные. Сорт - рекомендую.",03 мая 2025  · Карта: xxx83,https://vkusvill.ru/goods/mandariny-nadorkott-69648.html,Мандарины Надоркотт,5,305,руб,/кг
Оксана,Всегда покупаю мандарины этого сорта. Но почему привозят разных сортов не понятно. В последний раз привезли мелкие и кислые. Есть не возможно.,02 мая 2025  · Карта: xxx44,https://vkusvill.ru/goods/mandariny-nadorkott-69648.html,Мандарины Надоркотт,1,305,руб,/кг
Дарья,"Мандарины сладкие, но ощущение будто перезрели",02 мая 2025  · Карта: xxx23,https://vkusvill.ru/goods/mandariny-nadorkott-69648.html,Мандарины Надоркотт,4,305,руб,/кг
Покупатель,Абсолютно все мандарины привезли гнилые ! Просто позорище!!!!!,02 мая 2025  · Карта: xxx38,https://vkusvill.ru/goods/mandariny-nadorkott-69648.html,Мандарины Надоркотт,1,305,руб,/кг
ИРИНА,"Вкусные. Сочные. Сладкие.Брала по ЗЦ, поэтому не в претензии за несколько пожухлых мандаринок",02 мая 2025  · Карта: xxx91,https://vkusvill.ru/goods/mandariny-nadorkott-69648.html,Мандарины Надоркотт,5,305,руб,/кг
Ольга Владимировна,"Вкусные, сочные, сладкие.",02 мая 2025  · Карта: xxx26,https://vkusvill.ru/goods/mandariny-nadorkott-69648.html,Мандарины Надоркотт,5,305,руб,/кг
Любовь,Беру только эти мандарины!,02 мая 2025  · Карта: xxx96,https://vkusvill.ru/goods/mandariny-nadorkott-69648.html,Мандарины Надоркотт,5,305,руб,/кг
Эльмира,"Вкусные,сладкие,сочные привозите еще !",02 мая 2025  · Карта: xxx25,https://vkusvill.ru/goods/mandariny-nadorkott-69648.html,Мандарины Надоркотт,5,305,руб,/кг
Вкусвиллов,Мне попались сладкие и без косточек - просто мёд!,02 мая 2025  · Карта: xxx77,https://vkusvill.ru/goods/mandariny-nadorkott-69648.html,Мандарины Надоркотт,5,305,руб,/кг
Светлана,"Вкусные, сладкие, но немного мягковаты",01 мая 2025  · Карта: xxx04,https://vkusvill.ru/goods/mandariny-nadorkott-69648.html,Мандарины Надоркотт,4,305,руб,/кг
Наталия,Наталия. Хорошие!,01 мая 2025  · Карта: xxx94,https://vkusvill.ru/goods/mandariny-nadorkott-69648.html,Мандарины Надоркотт,5,305,руб,/кг
Юлия,Очень сладкие и в меру сочные мандарины 🍊,01 мая 2025  · Карта: xxx84,https://vkusvill.ru/goods/mandariny-nadorkott-69648.html,Мандарины Надоркотт,5,305,руб,/кг
Ольга,Очень мелкие и жесткие. Возможно привезли не то,01 мая 2025  · Карта: xxx30,https://vkusvill.ru/goods/mandariny-nadorkott-69648.html,Мандарины Надоркотт,2,305,руб,/кг
Анастасия,"Хорошие мандарины, сладкие, без косточек",01 мая 2025  · Карта: xxx06,https://vkusvill.ru/goods/mandariny-nadorkott-69648.html,Мандарины Надоркотт,5,305,руб,/кг
Ирина,"Заказываю эти мандарины обычно в Краснодаре, вкусные, сочные, иногда бывают подсохшие, но всё равно вкусные.
Уехала в Геленджик на выходные и заказала эти же мандарины доставкой, привезли абсолютно другой сорт и на вид, и на вкус. Невкусные. По этикетке всё верно. Такие странности))",01 мая 2025  · Карта: xxx54,https://vkusvill.ru/goods/mandariny-nadorkott-69648.html,Мандарины Надоркотт,5,305,руб,/кг
Дарья Александровна,"сладкие без кислинки, отлично чистятся, косточек нет. не старые в этот раз",30 апр 2025  · Карта: xxx40,https://vkusvill.ru/goods/mandariny-nadorkott-69648.html,Мандарины Надоркотт,5,305,руб,/кг
Ольга Аникиевна,Хорошие мандарины.,30 апр 2025  · Карта: xxx26,https://vkusvill.ru/goods/mandariny-nadorkott-69648.html,Мандарины Надоркотт,5,305,руб,/кг
ДИАНА,Сезон наверное закончился не вкусные,30 апр 2025  · Карта: xxx08,https://vkusvill.ru/goods/mandariny-nadorkott-69648.html,Мандарины Надоркотт,3,305,руб,/кг
